{
  "id": "01ARZ3NDEKTSV4RRFFQ69G5FAV",
  "rev": 1,
  "created_at": "2026-10-16T12:00:00Z",
  "updated_at": "2026-10-16T12:00:00Z",
  "project": "01ARZ3NDEKTSV4RRFFQ69G5FAW",
  "objective": "Validate a synthetic output",
  "criteria": [
    {
      "id": "c1",
      "text": "Result exists",
      "evidence": [],
      "met": false
    }
  ],
  "state": "open",
  "owner": "01ARZ3NDEKTSV4RRFFQ69G5FAX",
  "ownership_generation": 1,
  "dependencies": [],
  "open_decisions": [],
  "next_trigger": "source change",
  "delegation": "saga-delegation-1",
  "evidence": [],
  "checkpoints": [
    {
      "id": "k1",
      "at": "2026-10-16T12:00:00Z",
      "summary": "synthetic checkpoint",
      "evidence": [],
      "recorded_by": "01ARZ3NDEKTSV4RRFFQ69G5FAX",
      "provenance": {
        "source": "heimdall",
        "native_id": "heimdall-checkpoint-1",
        "native_rev": 1,
        "import_receipt": "receipt-1"
      }
    }
  ],
  "decisions": [
    {
      "id": "t1",
      "question": "Which option?",
      "choice": "A",
      "rationale": "fixture",
      "decided_by": "operator:fixture",
      "at": "2026-10-16T12:00:00Z",
      "evidence": [],
      "provenance": {
        "source": "heimdall",
        "native_id": "heimdall-decision-1",
        "native_rev": 1,
        "import_receipt": "receipt-1"
      }
    }
  ],
  "provenance": {
    "source": "heimdall",
    "native_id": "heimdall-task-1",
    "native_rev": 2,
    "import_receipt": "receipt-1"
  }
}
