{
  "id": "01ARZ3NDEKTSV4RRFFQ69G5FAV",
  "rev": 1,
  "created_at": "2026-10-16T12:00:00Z",
  "updated_at": "2026-10-16T12:00:00Z",
  "project": "01ARZ3NDEKTSV4RRFFQ69G5FAW",
  "objective": "Validate a synthetic output",
  "criteria": [
    {
      "id": "c1",
      "text": "Result exists",
      "evidence": [
        "evid:result"
      ],
      "met": true
    }
  ],
  "state": "closed",
  "owner": "01ARZ3NDEKTSV4RRFFQ69G5FAX",
  "ownership_generation": 1,
  "dependencies": [],
  "open_decisions": [],
  "next_trigger": "source change",
  "delegation": "saga-delegation-1",
  "evidence": [
    "evid:result"
  ],
  "checkpoints": [],
  "decisions": [],
  "provenance": null
}
